id,text,series_id,order
518,"Máme tabuľku s výrezom v tvare obráteného Z (obrázok), ktorá má túto vlastnosť: keď zakrúžkujeme ľubovoľných päť čísel tak, že v každom stĺpci aj v každom riadku je zakrúžkované práve jedno, a sčítame ich, vždy dostaneme rovnaký súčet. Doplňte čísla na prázdne (biele) miesta. Nájdite všetky riešenia.
<br /><br />
<center>
<img src=""https://seminar.strom.sk/media/problems/zad4s1-1.png"" />
</center>",75,4
521,"Štyri roboty sa nachádzajú na priamke a predstavujú body $P$, $Q$, $R$ a $S$  v nejakom poradí. Vieme, že dĺžky úsečiek $|PQ|$, $|QR|$, $|RS|$ a $|SP|$ sú jednotlivo $13$, $11$, $14$ a $12$. Aké je poradie bodov na priamke a aká je vzdialenosť medzi bodmi, ktoré sú od seba najvzdialenejšie? Nezabudnite nájsť všetky možnosti.",76,1
522,"Les má podobu štvorcovej tabuľky o rozmeroch $n\times n$, ktorá je vyplnená všetkými číslami od $1$ po $n\cdot n$ tak, že čísla v každom riadku, každom stĺpci a aj na oboch hlavných uhlopriečkach majú rôzne súčty. Aká najmenšia tabuľka sa dá zostrojiť? Prečo sa menšia už zostrojiť nedá? (Ak ste sa s tým ešte nestretli, tak $n$ označuje nejaké neznáme číslo. Ak by bolo napr. $n=4$, tak ide o tabuľku so $4$ riadkami a $4$ stĺpcami, kde nájdeme čísla od $1$ do $4\cdot4$, teda do $16$.)",76,2
523,"V obávanom bludisku sa nachádza portál pod jedným z polí $\alpha$ (alfa), $\beta$ (beta), $\gamma$ (gama), $\delta$ (delta), $\omega$ (omega). Každé pole sa nachádza na inom mieste (viď obrázok). Len pod jedným poľom sa nachádza portál a môžeme sa dostať len pod jedno zvolené pole. V okolí obávaného bludiska sa pohybovalo $5$ strážcov, každý o portáli tvrdil niečo iné. Postupne títo piati ľudia povedali:
<ol><li>Na najkratšej ceste za portálom sa musíš aspoň štyrikrát otočiť doprava.</li><li>Portál sa nachádza v riadku označenom písmenom zapisujúcim spoluhlásku.</li><li>Na najkratšej ceste za portálom musíš prejsť aspoň cez $15$ políčok.</li><li>Portál sa nachádza na políčku, ktoré je v stĺpci označenom párnym číslom.</li><li>Na najkratšej ceste za portálom sa musíš aspoň štyrikrát otočiť doľava.</li>
</ol>
Niektorí z nich však nehovorili pravdu. Ak by sme však vedeli, koľko z nich klamalo, dokázali by sme jednoznačne určiť, pod ktorým poľom sa portál nachádza. Pod ktorým? Do bludiska vchádzame otočení tým smerom, ktorým sme prišli. Na každom políčku sa vieme otočiť najviac jedenkrát, pričom otáčaním doprava resp. doľava myslíme otočenie o práve jednu štvrtinu kružnice.
<br />
<center>
<img src=""https://seminar.strom.sk/media/problems/zad3s2-1.png"" style=""width:250px;height:250px;"" />
</center>",76,3
524,"Hráč $A$ a Hráč $B$ majú na papieri napísaných $100$ jednotiek oddelených medzerami. Hráč $A$ začína a s Hráčom $B$ sa ťah po ťahu striedajú. Každý hráč musí v každom ťahu umiestniť medzi nejaké dve susedné jednotky znamienko plus alebo znamienko krát. Po vyplnení všetkých medzier ostane na papieri príklad, ktorého výsledok je buď párny, alebo nepárny. Ak je párny, vyhráva Hráč $A$, ak je nepárny, vyhráva Hráč $B$. Jeden z hráčov dokáže hrať tak, aby vždy vyhral, a to bez ohľadu na súperove ťahy. Ktorý z hráčov to je a prečo?",76,4
525,"Okolo okrúhleho stola je v pravidelných rozostupoch rozostavených pätnásť stoličiek. Na stole sú kartičky s menami pätnástich hostí. Hostia si všimli kartičky až keď si už sadli. A tak sa stalo, že nikto z pätnástich hostí nesedel pred svojou vlastnou kartičkou. Dokážte, že je možné otočiť stôl tak, aby aspoň dvaja hostia sedeli na správnych miestach.",76,5
526,"Koľko rôznych sedempísmenových &bdquo;slov&ldquo; vieme vytvoriť z písmen $A$, $B$, $C$, $D$? &bdquo;Slovo&ldquo; je ľubovoľný zhluk abecedne zoradených písmen - napríklad $AAAABBD$ je &bdquo;slovo&ldquo; ale $AACCBDA$ nie je. &bdquo;Slová&ldquo; sú rovnaké len vtedy, ak sa zhodujú písmená na všetkých ich pozíciách. V &bdquo;slove&ldquo; nemusíme použiť každé zo štyroch písmen.",76,6
527,"Majme mriežku $3\times 3$, v ktorej sú rozmiestnení pravdovravci a klamári (na každom políčku práve jeden). Pravdovravci vždy hovoria pravdu a klamári vždy klamú. Každý z nich vyslovil vetu: &bdquo;Na políčkach, ktoré susedia stranou s mojím políčkom, stoja práve dvaja takí, ako ja.&ldquo; Ako mohli byť rozmiestnení na mriežke? Nájdite všetky možnosti.",73,1
528,"Mória, Arga a Titanika hrali kartovú vojnu pre troch hráčov v niekoľkých kolách. Pred začiatkom hry sa dohodli, koľko bodov bude pre víťaza, druhého a porazeného, pričom body budú rovnaké vo všetkých kolách a všetky body budú celé číslo. Víťazstvo malo samozrejme najvyššie skóre. Porazený získal najnižšie skóre, ale stále aspoň $1$ bod. Arga zvíťazila v druhom kole. Konečné skóre bolo: Mória získala celkovo $20$ bodov, Arga $10$ bodov a Titanika $9$ bodov. Zistite, či táto informácia jasne určuje kto vyhral prvé kolo a koľko bodov získala v poslednom kole Titanika.",73,2
529,"Magický kruh je tvorený $13$ kameňmi. V $12$ kameňoch sa nachádza v každom rovnaký počet magických kryštálov a v jednom kameni je o jeden kryštál menej. Pri každom rituáli si môžeme vybrať práve $10$ kameňov, v ktorých vznikne jeden nový kryštál. Ukážte, že vieme vyberať kamene tak, aby sme na konci dostali $13$ kameňov s rovnakým počtom kryštálov. Čo ak by kameňov bolo $14$ a v jednom by bol o jeden kryštál menej?",73,3
530,"Runa, ktorú má Harold analyzovať je taký konvexný štvoruholník, čiže každý jeho uhol je menší ako $180^\circ$, že každá z uhlopriečok ho delí na dva trojuholníky rovnakého obsahu. Dokážte, že táto runa je rovnobežník.",73,4
531,"V tejto dimenzii sa nachádza niekoľko miest, o ktorých platí:
<ul><li>Z každého mesta vychádzajú práve $3$ cesty, z toho každá končí v inom meste, teda medzi dvoma mestami môže byť maximálne jedna neprerušená cesta.</li><li>Z každého mesta sa dá pomocou ciest dostať do akéhokoľvek iného mesta.</li><li>V tomto systéme ciest sa nachádzajú práve dve cesty také, po ktorých zničení sa mestá rozdelia na tri samostatné systémy, z ktorých sa nedá dostať do zvyšných dvoch. Tieto dve cesty končia v štyroch rôznych destináciách, teda každé z miest môže mať pri sebe maximálne jednu zničenú cestu.</li>
</ul>
Koľko najmenej miest môže v tejto dimenzii existovať? Nezabudnite načrtnúť, ako by mohli byť pospájané.",73,5
532,"Starček mal $100$ kartičiek s číslami od $1$ do $100$ (na každej kartičke iné číslo). Všetky mu však popadali a našiel len $21$ z nich. Starček chce vybrať $4$ kartičky a umiestniť ich do rovnosti $\ +\ =\ +\ $ . Bude mať dosť kartičiek na splnenie tejto úlohy, bez ohľadu na to, akých $21$ kartičiek mu ostalo k dispozícii?",73,6
533,"Mláčka mala tvar rovnoramenného trojuholníka $ABC$ so základňou $AB$ a obsahom $12$. Bod $D$ sa nachádza v opačnej polrovine určenej priamkou $AB$ ako bod $C$, pričom trojuholník $DBA$ je podobný s trojuholníkom $ABC$. Výška trojuholníka $ABC$ z bodu $C$ pretína priamku $BD$ v bode $X$. Aký je obsah trojuholníka $XBC$?",74,1
534,"Počas sto dní každý zo šiestich koní jedol práve $75$ dní. Koľko najviac a koľko najmenej mohlo byť dní, počas ktorých jedlo aspoň päť koní?",74,2
535,"Na oslave sú dievčatá a chlapci. Každý z $21$ chlapcov na oslave pozná práve $4$ dievčatá a každé dievča pozná práve $14$ chlapcov (známosti sú obojstranné). Dokážte, že ľubovoľní dvaja chlapci majú aspoň dve spoločné známe.",74,3
536,"Majme $5$ prirodzených čísel väčších ako $1$ a neprevyšujúcich $120$, o ktorých vieme, že nie sú prvočísla. Dokážte, že vždy vieme vybrať dve z nich, ktorých najväčší spoločný deliteľ je väčší ako $1$.",74,4
537,"Zaujímavý útvar vyzeral nasledovne: Vo štvorci $ABCD$ je stred strany $AB$ označený ako $M$. Priamka kolmá na priamku $MC$ prechádzajúca bodom $M$ pretína stranu $AD$ v bode $K$. Ukážte, že veľkosti uhlov $BCM$ a $KCM$ sú rovnaké.",74,5
538,"Koľko najmenej strelcov musíme umiestniť na šachovnicu $8\times8$ tak, aby každé políčko bolo ohrozené?",74,6
539,"Dokážte, že ak sú $a$, $b$, $c$, $d$ reálne čísla a $ac=2(b+d)$, tak má aspoň jedna z rovníc $x^2 + ax +b=0$ a $x^2+cx+d=0$ všetky korene reálne.",77,1
540,"Majme trojuholník $ABC$, kde $AB$ je najdlhšia jeho strana. Zvoľme bod $D$ tak, aby sa nachádzal na opačnej polpriamke k $BA$, teda $B$ je medzi bodmi $A$ a $D$ a zároveň platí $|BC|=|BD|$. Dokážte, že trojuholník $ACD$ je tupouhlý.",77,2
541,"Máme $n$ bodov v rovine. Môžeme urobiť to, že dva z nich vyberieme a následne obidva presunieme do stredu úsečky, ktorá ich spája. Body iba presúvame, žiaden z nich nezaniká. Zistite, pre ktoré $n$ je možné vždy presúvať dané body tak, aby všetky splynuli (boli v jednom bode).",77,3
542,"Nájdite všetky polynómy $P(x)$ s reálnymi koeficientami, ktoré spĺňajú $(x^2 - 6x + 8)\cdot P(x) = (x^2 + 2x)\cdot P(x-4)$ pre všetky reálne čísla $x$.",77,4
543,"Majme $n^2$ bodov rozmiestnených do mriežky $n\times n$. Z nich náhodne vyberieme $2n$ bodov. Dva vybrané body sú spojené zelenou úsečkou, ak sú v rovnakom riadku, a červenou úsečkou, ak sú v rovnakom stĺpci. Dokážte, že existuje uzavretá lomená čiara s vrcholmi vo vybraných bodoch a so stranami tvorenými týmito úsečkami taká, že sa farby jej strán striedajú.",77,5
544,"Prirodzené číslo $n$ nazveme chutné, ak pre ľubovoľné dve prirodzené čísla $a$, $b$ také, že $a+b=n$ platí, že aspoň jeden zo zlomkov $\frac ab,\frac ba$ má konečný desatinný rozvoj. Existuje nekonečne veľa chutných čísel? Svoje riešenie odôvodnite.",77,6
545,"Nech $ABCD$ je štvoruholník, v ktorom existuje kružnica, ktorá prechádza stredmi všetkých strán tohto štvoruholníka. Dokážte, že $AC$ a $BD$ sú na seba kolmé.",78,1
546,"Máme riadok, v ktorom je 1000 čísel. Pod tento riadok pridáme ďalší tak, že pod každým číslom $a$ je napísaná hodnota $f(a)$, kde $f(a)$ je počet výskytov čísla $a$ v predchádzajúcom riadku. Takto postupne pridávame ďalšie riadky. Dokážte, že po pridaní dostatočného počtu riadkov budú pod sebou dva rovnaké riadky.",78,2
547,"Je daná rovnica $x!y!z!=t!$, kde $x$, $y$, $z$, $t$ sú prirodzené čísla väčšie ako jedna. Ukážte, že existuje nekonečne veľa štvoríc $(x,y,z,t)$, ktoré spĺňajú túto rovnicu. <br>
<i>Pozn.: $n!$ je číslo $n\cdot (n-1)\cdot \dots \cdot 2\cdot 1$.</i>",78,3
548,"Majme $n$ nenulových čísel, ktorých súčet je 0. Ukážte, že je možné ich očíslovať tak, aby platila nerovnosť: $$a_1a_2 + a_2a_3 + \dots + a_na_1 < 0.$$",78,4
549,"Dokážte, že ľubovoľné celé číslo môže byť napísané ako súčet 5 tretích mocnín celých čísel.",78,5
550,"Nech $ABC$ je ostrouhlý trojuholník s $|AB|<|AC|$. Nech $M$, $N$ sú postupne stredy strán $AB$ a $AC$ a nech $AD$ je výška v tomto trojuholníku. Na úsečke $MN$ zvolíme taký bod $K$, že $|BK|=|CK|$. Polpriamka $KD$ pretína kružnicu opísanú trojuholníku $ABC$ v bode $Q$. Dokážte, že body $C$, $N$, $K$, $Q$ ležia na jednej kružnici.",78,6
551,"Po dlhom večeri vo vnútri salónika v tvare štvorca $ABCD$ leží opitý kupec $E$ tak, že trojuholník $DEC$ je rovnostranný. Na hrane $BC$ leží špeh $F$, pričom $|EB|=|EF|$. Aká je veľkosť uhla $CEF$?",79,1
552,"U neskrotného diviaka mali pred bitkou tridsať stolov označených prirodzenými číslami $2$ až $31$. Práve dva stoly patrili do salónika. Aby personál pri inventúre zistil, ktoré dva to sú, používal trik. Na dverách salónika bola tabuľka s číslom, ktoré nebolo deliteľné číslami stolov zo salónika, ale číslami všetkých ostatných stolov áno. Okrem toho, čísla stolov v salóniku nasledovali po sebe. Ktoré dve čísla to boli?",79,2
553,"Samopočet funguje presne ako kalkulačka. Hostinský chcel na samopočte sčítať niekoľko trojciferných prirodzených čísel. Na prvý pokus dostal výsledok $2224$. Pre kontrolu sčítal tieto čísla znova a vyšlo mu $2198$. Preto sčítal tieto čísla ešte raz a teraz dostal súčet $2204$. Piate pripočítavané číslo zadal totiž vždy nesprávne, lebo pri každom pokuse nestlačil niektorú z jeho cifier dostatočne silno a do samopočtu tak zadal vždy namiesto trojciferného čísla číslo dvojciferné. Žiadne ďalšie chyby pri sčítavaní už nespravil a samopočet taktiež tentokrát fungoval bezchybne. Aký je správny súčet hostinského čísel?",79,3
554,"Na špeciálnom stolčeku, ktorý hostinský vyniesol zo zadnej časti kuchyne, bola na pozadí umeleckého stvárnenia niekdajšej križovatky uprostred divočiny vyrezaná mriežka $8\times9$ políčok. V juhozápadnom rohu (políčko $A1$) leží hrací kameň. Pohybuje sa z políčka na políčko. Na ploche je tiež čierny stĺp, cez ktorý sa nedá pohybovať (ani preskočením). Dvaja hráči sa striedajú v ťahoch kameňom o ľubovoľný počet políčok na východ alebo sever. Víťazom je ten, kto dostane kameň svojím ťahom do cieľa (políčko $H9$). Rozhodnite a odôvodnite, či pre niektorého z hráčov existuje víťazná stratégia. Ak áno, popíšte ju. (Víťazná stratégia je návod, ako má hráč hrať, aby vždy vyhral, nech ten druhý hrá akokoľvek.)
<br>
<br>
<center><img src=""https://matik.strom.sk/media/problems/matik32-2-1-4.png"" alt=""matik32-2-1-4"" style=""width:340px;"" /></center>",79,4
555,"Miestnosť má tvar konvexného štvoruholníka $ABCD$ (to znamená, že všetky jeho vnútorné uhly majú menej ako $180^\circ$). Každá stena miestnosti je dvoma stolmi rozdelená na tri rovnako dlhé úseky ako na obrázku (stoly sú $K$, $P$, $L$, $Q$, $M$, $R$, $N$, $S$). Dokážte, že oblasti $KLMN$ a $PQRS$ majú zhodný obsah.
<br>
<br>
<center><img src=""https://matik.strom.sk/media/problems/matik32-2-1-5.png"" alt=""matik32-2-1-5"" style=""width:340px;"" /></center>",79,5
556,"Na cintoríne tvoria hroby políčka mriežky $2019\times2019$. Na každom z hrobov uvidí okoloidúci ľaliu, gerberu, chryzantému alebo mach (práve jedno z toho). Štvorec z hrobov veľkosti $2\times2$ vždy zahŕňa každú rastlinu. Dokážte, že niekde na cintoríne existuje rad hrobov $2019 \times 1$ alebo $1 \times 2019$, ktorý obsahuje iba dva druhy rastlín.",79,6
557,"V hostinci je $12$ štvorcových stolov so stranami $1$, $1$, $2$, $2$, $2$, $2$, $3$, $3$, $4$, $5$, $5$, $6$. Barón chce mať tieto stoly rozdelené na dve skupiny tak, aby bol v oboch skupinách rovnaký súčet obsahov aj obvodov štvorcov. Dokážte, že túto barónovu požiadavku v tomto hostinci nemožno splniť.",80,1
558,"Kým prírodu si obľúbil, kartové hry otcových zazobaných hostí z duše neznášal. V štvorcovej sieti je trojuholník $LES$ ako na obrázku. Určte súčet $|\sphericalangle ZLE|+|\sphericalangle ESO|$.
<br>
<br>
<center><img src=""https://matik.strom.sk/media/problems/matik32-2-2-2.png"" alt=""matik32-2-2-2"" style=""width:240px;"" /></center>",80,2
559,"Lotta má $16$ rokov, Dieter $12$. Pri pozorovaní a obsluhovaní tejto podivuhodnej spoločnosti starých alchymistov si všimli, že ak Lotta pridá svoj vek k vekom alchymistov, tak sa ich priemerný vek zníži o $10$ rokov. Ak sa k Lottinmu veku pridá aj ten Dieterov, tak sa priemerný vek zníži o ďalších $8$ rokov. Aký je priemerný vek spoločnosti alchymistov?",80,3
560,"Kornel sa chcel zblížiť so svojimi pisárikmi a svojimi dôstojnými poslucháčmi a to sa najlepšie robí pri riešení spoločného problému. Oznámil im preto: <q>Milé deti, všimol som si, že ak by vás bolo v miestnosti dvakrát viac, ako je teraz, a potom by jedno z vás odišlo, tak by váš počet bol deliteľný počtom učencov, ktorí sú teraz v miestnosti. Rovnako, ak by bol počet učencov v miestnosti dvojnásobný a jeden z nich by potom odišiel, tak by ich počet bol deliteľný počtom detí, ktoré sú teraz v miestnosti. Skúste teraz spoločne nájsť všetky možné počty detí a učencov v miestnosti.</q>",80,4
561,"Jednej noci sa Oto chcel zabaviť s Dieterom a tým, čo mu zostalo po otcovi. Zobrali si zo zachovaného voza trhaviny a začali hrať hru. Oto začína a striedajú sa v ťahoch. V každom ťahu si hráč vyberie výbušninu istej sily (z každého druhu majú dostatočne veľa kusov) a vyhodí ňou do povetria aspoň $1$ a najviac $5$ meštianskych domov (podľa sily trhaviny). Hra sa končí po vopred dohodnutom počte ťahov. Dieter vyhrá, ak je počet zničených domov násobkom $9$, inak vyhrá Oto. Nájdite víťaznú stratégiu pre niektorého z hráčov, ak hra končí po:
<ul><li>$10$ ťahoch,</li><li>$11$ ťahoch,</li><li>$12$ ťahoch.</li>
</ul>",80,5
562,"V háji rastie mnoho stromov a iných rastlín, ktoré pokrývajú štvorec $TRAP$. Na uhlopriečke $AT$ sa nachádza bod $S$, ktorý nie je totožný s bodom $A$, $T$, ani so stredom uhlopriečky $AT$. Ortocentrum (priesečník výšok) trojuholníka $STR$ označme $L$ a trojuholníka $RAS$ ako $N$. Dokážte, že altán $ALTN$ je kosoštvorec.",80,6
563,"Na zozname boli zapísaní (nie nutne v tomto poradí) Adam, Barča, Cyril, Dory, Ema a Fred. Každý z nich povedal jeden pravdivý výrok: </br>
Adam: ,,Som zapísaný v prvej polovici zoznamu.‘‘ </br>
Barča: ,,Moje poradové číslo je o jeden menšie, ako má Dory.‘‘ </br>
Cyril: ,,Nie som posledný.‘‘ </br>
Dory: ,,Ema nie je v druhej polovici zoznamu.‘‘ </br>
Ema: ,,Mám párne poradové číslo.‘‘ </br>
Fred: ,,Moje poradové číslo na zozname je menšie, ako má Adam.‘‘ </br>
Zistite, v akom poradí boli súrodenci zapísaní na sprchovacom zozname, ak vieme, že na každom mieste môže byť zapísaný len jeden. Nájdite všetky možnosti a odôvodnite, že iné nie sú.",81,1
564,"Na stole sú 3 nádobky, v jednej sú červené jablká, v druhej zelené a v tretej červené aj zelené. Nádobky sú označené nápismi ,,červené‘‘, ,,zelené‘‘ a ,,červené a zelené‘‘, avšak každá má na sebe zlý nápis. Môžete si určiť nádobku a so zavretými očami vytiahnuť jablko. Na koľko najmenej vytiahnutí jabĺk (so zavretými očami) a pozretí si ich farby vieme s istotou určiť, ako majú byť nádobky označené správne? Nezabudnite, že vopred neviete, aké jablko vytiahnete, preto rozoberte všetky možnosti.",81,2
565,Pole má tvar trojuholníka $ABC$. Uhol pri vrchole $C$ je $40^\circ$. Osi uhlov pri vrcholoch $A$ a $B$ sa pretnú v bode $D$. Aký veľký je uhol $ADB$? Úlohu riešte všeobecne a bez rysovania.,81,3
566,"Na stole je položená klasická hracia kocka (súčet čísel na protiľahlých stenách je 7). Pri stole sedí 5 Fredových súrodencov, z ktorých všetci vidia práve 3 steny kocky. Fred im položil otázku: Aký je súčet čísel na stenách, ktoré vidíte? Dostal od nich takéto odpovede: Anita - 7, Blahoslav - 9, Ctibor - 10, Dobroslav - 14, Eugen - 15, avšak jeden z nich nevie počítať. Kto to je? Nezabudnite vysvetliť, prečo práve on.",81,4
567,"V trojuholníku $ABC$ platí $|AC| = |BC|$. Na úsečke $BC$ je bod $F$ taký, že $|AB| = |AF| = |FC|$. Nájdite hodnoty vnútorných uhlov trojuholníka $ABC$. Úlohu riešte všeobecne a bez rysovania.",81,5
568,"Tatko Zajko a Mamka Zajková spoločne organizujú večierok. Pozvali štyri ďalšie manželské páry (každý manželský pár sa samozrejme navzájom pozná). Tatko Zajko a Mamka Zajková nemusia nutne poznať každého pozvaného. Na večierku si podajú ruky tie dvojice ľudí, ktoré sa nepoznajú. Potom sa Tatko Zajko každého okrem seba opýtal, s koľkými ľuďmi si podali ruku. Každý mu povedal iné číslo. S koľkými ľuďmi si podala ruku Mamka Zajková?",81,6
569,"V kruhu sedí niekoľko malých zajačikov. Prvý z nich povie: ,,Je nás tu 6‘‘ a vyskočí z kruhu preč. Postupne vyskakuje z kruhu ďalší a ďalší zajačik a vždy povie: ,,Všetci, čo vyskočili predo mnou, klamali.‘‘ Takto to pokračuje až kým v kruhu nebude sedieť ani jeden zajačik. Koľko zajačikov hovorilo pravdu? Nájdite všetky možnosti a svoje riešenie odôvodnite.",82,1
570,"Na papieriku stálo, že štvormiestny PIN kód od dverí je zaujímavý:
<ul><li> všetky jeho číslice sú prvočísla,</li><li> 1. a 2. číslica v tomto poradí vytvorí prvočíslo</li><li> 2. a 3. číslica v tomto poradí vytvorí prvočíslo</li><li> 3. a 4. číslica v tomto poradí vytvorí prvočíslo</li>
</ul>
Na papieriku taktiež stálo, že všetky uvedené informácie sú pravdivé a po vložení správneho PINu sa dvere odomknú. Koľko existuje takých štvormiestnych čísel, ktoré by mohli byť správnym PINom od dverí? Nezabudnite odôvodniť, že ste na žiadne možnosti nezabudli.</br>
</br>
Prvočíslo je prirodzené číslo väčšie ako 1, ktoré je deliteľné len číslom 1 a samo sebou.",82,2
574,"Obytný sektor má tvar štvorca $5 \times 5$ a každá miestnosť (štvorček $1 \times 1$) má priradené jednociferné číslo. V prípade núdze je potrebné vyfarbiť niektoré miestnosti tak, aby sa <b>žiadna</b> hodnota <strike>vyfarbenenej</strike> miestnosti nevyskytovala medzi nevyfarbenými hodnotami v žiadnom riadku ani stĺpci viac ako 1-krát. Ďalšou podmienkou je, že vyfarbené miestnosti sa nesmú dotýkať stranou a nevyfarbené musia tvoriť súvislú plochu (v nej musia byť všetky nevyfarbené miestnosti spojené stranou).

<ol type=""a""><li>Ukážte, že ak je v obytnom sektore $5 \times 5$ hneď vedľa seba (v jednom riadku alebo jednom stĺpci) umiestnená trojica rovnakých čísel, musia byť obe krajné miestnosti zafarbené a naopak stredná nesmie byť zafarbená. Svoje riešenie poriadne zdôvodnite.</li><li>Ukážte, že v obytnom sektore $5 \times 5$ nesmie byť číslo, ktoré by sa nachádzalo medzi dvojicou rovnakých čísel v jednom riadku alebo stĺpci, a zároveň by bolo zafarbené. Svoje riešenie poriadne zdôvodnite.</li><li>Vyfarbite štvorec na obrázku tak, aby vyhovoval podmienkam zadania. Spíšte aj postup v bodoch ako ste postupovali a prečo.</li>
</ol>

<b>POZOR! Tlačiarenský škriatok zapríčinil, že úloha má vo vašich časopisoch nesprávne zadanie. Správne zadanie nájdete tu a v sekcii časopisy na našej stránke.</b>
</p>

<center><img src=""https://matik.strom.sk/media/problems/zad3s4.png"" alt=""uloha2"" style=""width:240px;"" /></center>",82,3
571,"Vybratých 5 zajacov sa zúčastnilo turnaja. Každý s každým odohral práve jeden zápas. Za výhru získava hráč $1$ bod, za remízu $0{,}5$ bodu a za prehru $0$ bodov. O turnaji vieme len to, že zajac s najvyšším počtom bodov nemal žiadnu remízu. Zajac, ktorý skončil ako druhý, žiaden zápas neprehral. A každý zo zajacov získal iný počet bodov. Koľko bodov získali jednotlivé zajace? Nájdite všetky možnosti a odôvodnite, že iné nie sú.",82,4
572,"Fred a Henry hrajú hru, v ktorej si na začiatku Henry vymyslí dvojciferné prirodzené číslo. V každom ťahu potom Fred povie Henrymu nejaké prirodzené číslo $f$, ktoré je väčšie ako 1. Ak je Henryho číslo násobkom Fredovho čísla $f$, tak Fred vyhráva. V opačnom prípade Henry odčíta Fredove číslo $f$ od svojho aktuálneho čísla a hra pokračuje ďalším ťahom s novým číslom $f$. V momente, keď Henry dostane záporné číslo (číslo menšie ako 0), tak Fred prehrá. Ak je to možné, tak vymyslite ako má Fred hrať, aby vždy vyhral.",82,5
573,"Máme $3 \times 7$ mín na mínovom poli rozmiestnených do tvaru štvorčekovej mriežky. Každá mína je ofarbená práve jednou z dvoch farieb. Ukážte, že nech sú míny ofarbené akokoľvek, tak v mriežke vždy existuje obdĺžnik so <b> štyrmi </b> mínami (vrcholmi) jednej farby. Rovnakej farby musia byť len vrcholy obdĺžnika. ",82,6
575,"Dokážte, že $\sqrt{n+1} + \sqrt{n-1}$ nie je racionálne číslo pre žiadne celočíselné $n$.",83,1
576,"Nech $a$, $b$, $c$, $x$, $y$ a $z$ sú nezáporné reálne čísla také, že $a^2 + b^2 = c^2$ a $x^2+y^2=z^2$. Dokážte, že potom platí $(a+x)^2 + (b+y)^2 \leq (c+z)^2$ a zistite, kedy nastáva rovnosť.",83,2
577,"Máme šachovnicu $n\times n$. Niektoré políčka (okrem ľavého horného a pravého dolného rohu) nafarbíme na červeno tak, že šachový kôň sa nevie dostať z ľavého horného rohu do pravého dolného rohu bez toho, aby musel stúpiť na červené políčko. Zistite, pre ktoré $n$ platí, že pri ľubovoľnom takomto ofarbení vieme nájsť tri po sebe idúce políčka na nejakej diagonále (berieme do úvahy všetky diagonály, nielen uhlopriečky štvorca) také, že aspoň dve z nich sú červené.",83,3
578,"Lichobežník $ABCD$ je vpísaný do kružnice tak, že základňa lichobežníka $AB$ je jej priemer. Označme $E$ priesečník uhlopriečok lichobežníka $ABCD$, $S$ stred úsečky $AB$ a zostrojíme bod $X$ tak, aby bol $ASEX$ rovnobežník. Ukážte, že $|XA|=|XD|$.",83,4
579,"Dokážte, že ak funkcia $f:\mathbb{R} \rightarrow \mathbb{R}$ spĺňa nerovnosti $f(x)\leq x$ a $f(x+y) \leq f(x)+f(y)$ pre všetky $x$, $y$ reálne čísla, potom $f(x)=x$ pre všetky reálne $x$.",83,5
